root@ubuntu-s-1vcpu-1gb-tor1-01:~# tcpdump -i eth0 tcp
tcpdump: verbose output suppressed, use -v or -vv for full protocol decode
listening on eth0, link-type EN10MB (Ethernet), capture size 262144 bytes
16:19:11.306589 IP ubuntu-s-1vcpu-1gb-tor1-01.ssh > 198.96.85.163.44901: Flags [P.], seq 2081021533:2081021641, ack 2982672685, win 309, options [nop,nop,TS val 941594372 ecr 1439561080], length 108
16:19:11.306667 IP ubuntu-s-1vcpu-1gb-tor1-01.ssh > 198.96.85.163.44901: Flags [P.], seq 108:144, ack 1, win 309, options [nop,nop,TS val 941594373 ecr 1439561080], length 36
16:19:11.307133 IP ubuntu-s-1vcpu-1gb-tor1-01.ssh > 198.96.85.163.44901: Flags [P.], seq 144:252, ack 1, win 309, options [nop,nop,TS val 941594373 ecr 1439561080], length 108
16:19:11.307197 IP ubuntu-s-1vcpu-1gb-tor1-01.ssh > 198.96.85.163.44901: Flags [P.], seq 252:288, ack 1, win 309, options [nop,nop,TS val 941594373 ecr 1439561080], length 36
16:19:11.309248 IP ubuntu-s-1vcpu-1gb-tor1-01.ssh > 198.96.85.163.44901: Flags [P.], seq 288:524, ack 1, win 309, options [nop,nop,TS val 941594375 ecr 1439561080], length 236
16:19:11.309316 IP ubuntu-s-1vcpu-1gb-tor1-01.ssh > 198.96.85.163.44901: Flags [P.], seq 524:560, ack 1, win 309, options [nop,nop,TS val 941594375 ecr 1439561080], length 36
16:19:11.309415 IP ubuntu-s-1vcpu-1gb-tor1-01.ssh > 198.96.85.163.44901: Flags [P.], seq 560:772, ack 1, win 309, options [nop,nop,TS val 941594375 ecr 1439561080], length 212
16:19:11.309478 IP ubuntu-s-1vcpu-1gb-tor1-01.ssh > 198.96.85.163.44901: Flags [P.], seq 772:808, ack 1, win 309, options [nop,nop,TS val 941594375 ecr 1439561080], length 36
16:19:11.309572 IP ubuntu-s-1vcpu-1gb-tor1-01.ssh > 198.96.85.163.44901: Flags [P.], seq 808:1020, ack 1, win 309, options [nop,nop,TS val 941594375 ecr 1439561080], length 212
16:19:11.312838 IP 198.96.85.163.44901 > ubuntu-s-1vcpu-1gb-tor1-01.ssh: Flags [.], ack 0, win 2047, options [nop,nop,TS val 1439561087 ecr 941594366], length 0
16:19:11.312864 IP ubuntu-s-1vcpu-1gb-tor1-01.ssh > 198.96.85.163.44901: Flags [P.], seq 1020:2544, ack 1, win 309, options [nop,nop,TS val 941594379 ecr 1439561087], length 1524
16:19:11.320170 IP 198.96.85.163.44901 > ubuntu-s-1vcpu-1gb-tor1-01.ssh: Flags [.], ack 108, win 2046, options [nop,nop,TS val 1439561093 ecr 941594372], length 0
16:19:11.320215 IP ubuntu-s-1vcpu-1gb-tor1-01.ssh > 198.96.85.163.44901: Flags [P.], seq 2544:3024, ack 1, win 309, options [nop,nop,TS val 941594386 ecr 1439561093], length 480
16:19:11.320237 IP 198.96.85.163.44901 > ubuntu-s-1vcpu-1gb-tor1-01.ssh: Flags [.], ack 144, win 2045, options [nop,nop,TS val 1439561093 ecr 941594373], length 0
16:19:11.320433 IP ubuntu-s-1vcpu-1gb-tor1-01.ssh > 198.96.85.163.44901: Flags [P.], seq 3024:3220, ack 1, win 309, options [nop,nop,TS val 941594386 ecr 1439561093], length 196
16:19:11.320506 IP ubuntu-s-1vcpu-1gb-tor1-01.ssh > 198.96.85.163.44901: Flags [P.], seq 3220:3256, ack 1, win 309, options [nop,nop,TS val 941594386 ecr 1439561093], length 36
16:19:11.320601 IP ubuntu-s-1vcpu-1gb-tor1-01.ssh > 198.96.85.163.44901: Flags [P.], seq 3256:3468, ack 1, win 309, options [nop,nop,TS val 941594386 ecr 1439561093], length 212
16:19:11.320935 IP 198.96.85.163.44901 > ubuntu-s-1vcpu-1gb-tor1-01.ssh: Flags [.], ack 252, win 2046, options [nop,nop,TS val 1439561093 ecr 941594373], length 0
16:19:11.320949 IP ubuntu-s-1vcpu-1gb-tor1-01.ssh > 198.96.85.163.44901: Flags [P.], seq 3468:4232, ack 1, win 309, options [nop,nop,TS val 941594387 ecr 1439561093], length 764
16:19:11.320963 IP 198.96.85.163.44901 > ubuntu-s-1vcpu-1gb-tor1-01.ssh: Flags [.], ack 288, win 2045, options [nop,nop,TS val 1439561093 ecr 941594373], length 0
16:19:11.320968 IP 198.96.85.163.44901 > ubuntu-s-1vcpu-1gb-tor1-01.ssh: Flags [.], ack 524, win 2042, options [nop,nop,TS val 1439561093 ecr 941594375], length 0
16:19:11.320971 IP 198.96.85.163.44901 > ubuntu-s-1vcpu-1gb-tor1-01.ssh: Flags [.], ack 560, win 2041, options [nop,nop,TS val 1439561093 ecr 941594375], length 0
16:19:11.321055 IP ubuntu-s-1vcpu-1gb-tor1-01.ssh > 198.96.85.163.44901: Flags [P.], seq 4232:4444, ack 1, win 309, options [nop,nop,TS val 941594387 ecr 1439561093], length 212
16:19:11.321270 IP ubuntu-s-1vcpu-1gb-tor1-01.ssh > 198.96.85.163.44901: Flags [P.], seq 4480:4676, ack 1, win 309, options [nop,nop,TS val 941594387 ecr 1439561093], length 196
16:19:11.321430 IP ubuntu-s-1vcpu-1gb-tor1-01.ssh > 198.96.85.163.44901: Flags [P.], seq 4712:4924, ack 1, win 309, options [nop,nop,TS val 941594387 ecr 1439561093], length 212
16:19:11.321636 IP ubuntu-s-1vcpu-1gb-tor1-01.ssh > 198.96.85.163.44901: Flags [P.], seq 4960:5156, ack 1, win 309, options [nop,nop,TS val 941594388 ecr 1439561093], length 196
16:19:11.321837 IP ubuntu-s-1vcpu-1gb-tor1-01.ssh > 198.96.85.163.44901: Flags [P.], seq 5192:5388, ack 1, win 309, options [nop,nop,TS val 941594388 ecr 1439561093], length 196
16:19:11.321991 IP ubuntu-s-1vcpu-1gb-tor1-01.ssh > 198.96.85.163.44901: Flags [P.], seq 5424:5620, ack 1, win 309, options [nop,nop,TS val 941594388 ecr 1439561093], length 196
16:19:11.322149 IP ubuntu-s-1vcpu-1gb-tor1-01.ssh > 198.96.85.163.44901: Flags [P.], seq 5656:5868, ack 1, win 309, options [nop,nop,TS val 941594388 ecr 1439561093], length 212
16:19:11.322330 IP ubuntu-s-1vcpu-1gb-tor1-01.ssh > 198.96.85.163.44901: Flags [P.], seq 5904:6116, ack 1, win 309, options [nop,nop,TS val 941594388 ecr 1439561093], length 212
16:19:11.322461 IP ubuntu-s-1vcpu-1gb-tor1-01.ssh > 198.96.85.163.44901: Flags [P.], seq 6152:6364, ack 1, win 309, options [nop,nop,TS val 941594388 ecr 1439561093], length 212
16:19:11.325185 IP 198.96.85.163.44901 > ubuntu-s-1vcpu-1gb-tor1-01.ssh: Flags [.], ack 3024, win 2040, options [nop,nop,TS val 1439561100 ecr 941594386], length 0
16:19:11.325210 IP ubuntu-s-1vcpu-1gb-tor1-01.ssh > 198.96.85.163.44901: Flags [P.], seq 6364:7888, ack 1, win 309, options [nop,nop,TS val 941594391 ecr 1439561100], length 1524
16:19:11.333972 IP 198.96.85.163.44901 > ubuntu-s-1vcpu-1gb-tor1-01.ssh: Flags [.], ack 3220, win 2044, options [nop,nop,TS val 1439561104 ecr 941594386], length 0
16:19:11.334027 IP ubuntu-s-1vcpu-1gb-tor1-01.ssh > 198.96.85.163.44901: Flags [P.], seq 7888:8376, ack 1, win 309, options [nop,nop,TS val 941594400 ecr 1439561104], length 488
16:19:11.334055 IP 198.96.85.163.44901 > ubuntu-s-1vcpu-1gb-tor1-01.ssh: Flags [.], ack 3256, win 2044, options [nop,nop,TS val 1439561104 ecr 941594386], length 0
16:19:11.334252 IP ubuntu-s-1vcpu-1gb-tor1-01.ssh > 198.96.85.163.44901: Flags [P.], seq 8376:8580, ack 1, win 309, options [nop,nop,TS val 941594400 ecr 1439561104], length 204
16:19:11.334331 IP ubuntu-s-1vcpu-1gb-tor1-01.ssh > 198.96.85.163.44901: Flags [P.], seq 8580:8616, ack 1, win 309, options [nop,nop,TS val 941594400 ecr 1439561104], length 36
16:19:11.334438 IP ubuntu-s-1vcpu-1gb-tor1-01.ssh > 198.96.85.163.44901: Flags [P.], seq 8616:8828, ack 1, win 309, options [nop,nop,TS val 941594400 ecr 1439561104], length 212
16:19:11.343720 IP 198.96.85.163.44901 > ubuntu-s-1vcpu-1gb-tor1-01.ssh: Flags [.], ack 3468, win 2041, options [nop,nop,TS val 1439561104 ecr 941594386], length 0
16:19:11.343759 IP ubuntu-s-1vcpu-1gb-tor1-01.ssh > 198.96.85.163.44901: Flags [P.], seq 8828:9848, ack 1, win 309, options [nop,nop,TS val 941594410 ecr 1439561104], length 1020
16:19:11.343779 IP 198.96.85.163.44901 > ubuntu-s-1vcpu-1gb-tor1-01.ssh: Flags [.], ack 4232, win 2036, options [nop,nop,TS val 1439561110 ecr 941594387], length 0
16:19:11.343786 IP 198.96.85.163.44901 > ubuntu-s-1vcpu-1gb-tor1-01.ssh: Flags [.], ack 4444, win 2032, options [nop,nop,TS val 1439561110 ecr 941594387], length 0
16:19:11.343792 IP 198.96.85.163.44901 > ubuntu-s-1vcpu-1gb-tor1-01.ssh: Flags [.], ack 4480, win 2032, options [nop,nop,TS val 1439561110 ecr 941594387], length 0
16:19:11.343796 IP 198.96.85.163.44901 > ubuntu-s-1vcpu-1gb-tor1-01.ssh: Flags [.], ack 4676, win 2029, options [nop,nop,TS val 1439561110 ecr 941594387], length 0
16:19:11.343799 IP 198.96.85.163.44901 > ubuntu-s-1vcpu-1gb-tor1-01.ssh: Flags [.], ack 4712, win 2028, options [nop,nop,TS val 1439561110 ecr 941594387], length 0
16:19:11.344153 IP ubuntu-s-1vcpu-1gb-tor1-01.ssh > 198.96.85.163.44901: Flags [P.], seq 10088:10300, ack 1, win 309, options [nop,nop,TS val 941594410 ecr 1439561110], length 212
16:19:11.344262 IP ubuntu-s-1vcpu-1gb-tor1-01.ssh > 198.96.85.163.44901: Flags [P.], seq 10336:10540, ack 1, win 309, options [nop,nop,TS val 941594410 ecr 1439561110], length 204
16:19:11.344366 IP ubuntu-s-1vcpu-1gb-tor1-01.ssh > 198.96.85.163.44901: Flags [P.], seq 10576:10780, ack 1, win 309, options [nop,nop,TS val 941594410 ecr 1439561110], length 204
16:19:11.344478 IP ubuntu-s-1vcpu-1gb-tor1-01.ssh > 198.96.85.163.44901: Flags [P.], seq 10816:11020, ack 1, win 309, options [nop,nop,TS val 941594410 ecr 1439561110], length 204
16:19:11.344582 IP ubuntu-s-1vcpu-1gb-tor1-01.ssh > 198.96.85.163.44901: Flags [P.], seq 11056:11260, ack 1, win 309, options [nop,nop,TS val 941594410 ecr 1439561110], length 204
16:19:11.344683 IP ubuntu-s-1vcpu-1gb-tor1-01.ssh > 198.96.85.163.44901: Flags [P.], seq 11296:11500, ack 1, win 309, options [nop,nop,TS val 941594411 ecr 1439561110], length 204
16:19:11.344813 IP ubuntu-s-1vcpu-1gb-tor1-01.ssh > 198.96.85.163.44901: Flags [P.], seq 11536:11756, ack 1, win 309, options [nop,nop,TS val 941594411 ecr 1439561110], length 220
16:19:11.344922 IP ubuntu-s-1vcpu-1gb-tor1-01.ssh > 198.96.85.163.44901: Flags [P.], seq 11792:12012, ack 1, win 309, options [nop,nop,TS val 941594411 ecr 1439561110], length 220
16:19:11.345025 IP ubuntu-s-1vcpu-1gb-tor1-01.ssh > 198.96.85.163.44901: Flags [P.], seq 12048:12268, ack 1, win 309, options [nop,nop,TS val 941594411 ecr 1439561110], length 220
16:19:11.345138 IP ubuntu-s-1vcpu-1gb-tor1-01.ssh > 198.96.85.163.44901: Flags [P.], seq 12304:12524, ack 1, win 309, options [nop,nop,TS val 941594411 ecr 1439561110], length 220
16:19:11.345240 IP ubuntu-s-1vcpu-1gb-tor1-01.ssh > 198.96.85.163.44901: Flags [P.], seq 12560:12780, ack 1, win 309, options [nop,nop,TS val 941594411 ecr 1439561110], length 220
16:19:11.345343 IP ubuntu-s-1vcpu-1gb-tor1-01.ssh > 198.96.85.163.44901: Flags [P.], seq 12816:13036, ack 1, win 309, options [nop,nop,TS val 941594411 ecr 1439561110], length 220
16:19:11.345445 IP ubuntu-s-1vcpu-1gb-tor1-01.ssh > 198.96.85.163.44901: Flags [P.], seq 13072:13292, ack 1, win 309, options [nop,nop,TS val 941594411 ecr 1439561110], length 220
16:19:11.345562 IP ubuntu-s-1vcpu-1gb-tor1-01.ssh > 198.96.85.163.44901: Flags [P.], seq 13328:13548, ack 1, win 309, options [nop,nop,TS val 941594411 ecr 1439561110], length 220
16:19:11.345670 IP ubuntu-s-1vcpu-1gb-tor1-01.ssh > 198.96.85.163.44901: Flags [P.], seq 13584:13804, ack 1, win 309, options [nop,nop,TS val 941594412 ecr 1439561110], length 220
16:19:11.345774 IP ubuntu-s-1vcpu-1gb-tor1-01.ssh > 198.96.85.163.44901: Flags [P.], seq 13840:14060, ack 1, win 309, options [nop,nop,TS val 941594412 ecr 1439561110], length 220
16:19:11.345925 IP ubuntu-s-1vcpu-1gb-tor1-01.ssh > 198.96.85.163.44901: Flags [P.], seq 14096:14316, ack 1, win 309, options [nop,nop,TS val 941594412 ecr 1439561115], length 220
16:19:11.346033 IP ubuntu-s-1vcpu-1gb-tor1-01.ssh > 198.96.85.163.44901: Flags [P.], seq 14352:14572, ack 1, win 309, options [nop,nop,TS val 941594412 ecr 1439561115], length 220
16:19:11.346143 IP ubuntu-s-1vcpu-1gb-tor1-01.ssh > 198.96.85.163.44901: Flags [P.], seq 14572:15336, ack 1, win 309, options [nop,nop,TS val 941594412 ecr 1439561115], length 764
16:19:11.346242 IP ubuntu-s-1vcpu-1gb-tor1-01.ssh > 198.96.85.163.44901: Flags [P.], seq 15336:15916, ack 1, win 309, options [nop,nop,TS val 941594412 ecr 1439561115], length 580
16:19:11.346309 IP ubuntu-s-1vcpu-1gb-tor1-01.ssh > 198.96.85.163.44901: Flags [P.], seq 15916:16136, ack 1, win 309, options [nop,nop,TS val 941594412 ecr 1439561115], length 220
16:19:11.346375 IP ubuntu-s-1vcpu-1gb-tor1-01.ssh > 198.96.85.163.44901: Flags [P.], seq 16136:16356, ack 1, win 309, options [nop,nop,TS val 941594412 ecr 1439561115], length 220
16:19:11.346440 IP ubuntu-s-1vcpu-1gb-tor1-01.ssh > 198.96.85.163.44901: Flags [P.], seq 16356:16576, ack 1, win 309, options [nop,nop,TS val 941594412 ecr 1439561115], length 220
16:19:11.346505 IP ubuntu-s-1vcpu-1gb-tor1-01.ssh > 198.96.85.163.44901: Flags [P.], seq 16576:16796, ack 1, win 309, options [nop,nop,TS val 941594412 ecr 1439561115], length 220
16:19:11.346570 IP ubuntu-s-1vcpu-1gb-tor1-01.ssh > 198.96.85.163.44901: Flags [P.], seq 16796:17016, ack 1, win 309, options [nop,nop,TS val 941594412 ecr 1439561115], length 220
16:19:11.346637 IP ubuntu-s-1vcpu-1gb-tor1-01.ssh > 198.96.85.163.44901: Flags [P.], seq 17016:17236, ack 1, win 309, options [nop,nop,TS val 941594413 ecr 1439561115], length 220
16:19:11.346692 IP 198.96.85.163.44901 > ubuntu-s-1vcpu-1gb-tor1-01.ssh: Flags [.], ack 9848, win 2032, options [nop,nop,TS val 1439561121 ecr 941594410], length 0
16:19:11.346769 IP ubuntu-s-1vcpu-1gb-tor1-01.ssh > 198.96.85.163.44901: Flags [P.], seq 17236:17616, ack 1, win 309, options [nop,nop,TS val 941594413 ecr 1439561121], length 380
16:19:11.346855 IP 198.96.85.163.44901 > ubuntu-s-1vcpu-1gb-tor1-01.ssh: Flags [.], ack 10052, win 2044, options [nop,nop,TS val 1439561122 ecr 941594410], length 0
16:19:11.346871 IP ubuntu-s-1vcpu-1gb-tor1-01.ssh > 198.96.85.163.44901: Flags [P.], seq 17616:17836, ack 1, win 309, options [nop,nop,TS val 941594413 ecr 1439561122], length 220
16:19:11.346957 IP ubuntu-s-1vcpu-1gb-tor1-01.ssh > 198.96.85.163.44901: Flags [P.], seq 17836:18224, ack 1, win 309, options [nop,nop,TS val 941594413 ecr 1439561122], length 388
16:19:11.347024 IP ubuntu-s-1vcpu-1gb-tor1-01.ssh > 198.96.85.163.44901: Flags [P.], seq 18224:18444, ack 1, win 309, options [nop,nop,TS val 941594413 ecr 1439561122], length 220
16:19:11.347090 IP ubuntu-s-1vcpu-1gb-tor1-01.ssh > 198.96.85.163.44901: Flags [P.], seq 18444:18664, ack 1, win 309, options [nop,nop,TS val 941594413 ecr 1439561122], length 220
16:19:11.347170 IP ubuntu-s-1vcpu-1gb-tor1-01.ssh > 198.96.85.163.44901: Flags [P.], seq 18664:18884, ack 1, win 309, options [nop,nop,TS val 941594413 ecr 1439561122], length 220
16:19:11.347236 IP ubuntu-s-1vcpu-1gb-tor1-01.ssh > 198.96.85.163.44901: Flags [P.], seq 18884:19104, ack 1, win 309, options [nop,nop,TS val 941594413 ecr 1439561122], length 220
16:19:11.347300 IP ubuntu-s-1vcpu-1gb-tor1-01.ssh > 198.96.85.163.44901: Flags [P.], seq 19104:19324, ack 1, win 309, options [nop,nop,TS val 941594413 ecr 1439561122], length 220
16:19:11.347846 IP 198.96.85.163.44901 > ubuntu-s-1vcpu-1gb-tor1-01.ssh: Flags [.], ack 10088, win 2044, options [nop,nop,TS val 1439561122 ecr 941594410], length 0
16:19:11.347861 IP ubuntu-s-1vcpu-1gb-tor1-01.ssh > 198.96.85.163.44901: Flags [P.], seq 19324:19544, ack 1, win 309, options [nop,nop,TS val 941594414 ecr 1439561122], length 220
16:19:11.347875 IP 198.96.85.163.44901 > ubuntu-s-1vcpu-1gb-tor1-01.ssh: Flags [.], ack 10300, win 2040, options [nop,nop,TS val 1439561122 ecr 941594410], length 0
16:19:11.347880 IP 198.96.85.163.44901 > ubuntu-s-1vcpu-1gb-tor1-01.ssh: Flags [.], ack 10336, win 2040, options [nop,nop,TS val 1439561122 ecr 941594410], length 0
16:19:11.347884 IP 198.96.85.163.44901 > ubuntu-s-1vcpu-1gb-tor1-01.ssh: Flags [.], ack 10540, win 2037, options [nop,nop,TS val 1439561122 ecr 941594410], length 0
16:19:11.347887 IP 198.96.85.163.44901 > ubuntu-s-1vcpu-1gb-tor1-01.ssh: Flags [.], ack 10576, win 2036, options [nop,nop,TS val 1439561122 ecr 941594410], length 0
16:19:11.347891 IP 198.96.85.163.44901 > ubuntu-s-1vcpu-1gb-tor1-01.ssh: Flags [.], ack 10780, win 2033, options [nop,nop,TS val 1439561122 ecr 941594410], length 0
16:19:11.348012 IP 198.96.85.163.44901 > ubuntu-s-1vcpu-1gb-tor1-01.ssh: Flags [.], ack 10816, win 2032, options [nop,nop,TS val 1439561122 ecr 941594410], length 0
16:19:11.348021 IP 198.96.85.163.44901 > ubuntu-s-1vcpu-1gb-tor1-01.ssh: Flags [.], ack 11020, win 2029, options [nop,nop,TS val 1439561122 ecr 941594410], length 0
16:19:11.348025 IP 198.96.85.163.44901 > ubuntu-s-1vcpu-1gb-tor1-01.ssh: Flags [.], ack 11056, win 2029, options [nop,nop,TS val 1439561122 ecr 941594410], length 0
16:19:11.348029 IP 198.96.85.163.44901 > ubuntu-s-1vcpu-1gb-tor1-01.ssh: Flags [.], ack 11260, win 2025, options [nop,nop,TS val 1439561122 ecr 941594410], length 0
16:19:11.348032 IP 198.96.85.163.44901 > ubuntu-s-1vcpu-1gb-tor1-01.ssh: Flags [.], ack 11296, win 2025, options [nop,nop,TS val 1439561122 ecr 941594411], length 0
16:19:11.348056 IP 198.96.85.163.44901 > ubuntu-s-1vcpu-1gb-tor1-01.ssh: Flags [.], ack 11500, win 2022, options [nop,nop,TS val 1439561122 ecr 941594411], length 0
16:19:11.348061 IP 198.96.85.163.44901 > ubuntu-s-1vcpu-1gb-tor1-01.ssh: Flags [.], ack 11536, win 2021, options [nop,nop,TS val 1439561122 ecr 941594411], length 0
16:19:11.348162 IP 198.96.85.163.44901 > ubuntu-s-1vcpu-1gb-tor1-01.ssh: Flags [.], ack 12304, win 2009, options [nop,nop,TS val 1439561122 ecr 941594411], length 0
16:19:11.348256 IP ubuntu-s-1vcpu-1gb-tor1-01.ssh > 198.96.85.163.44901: Flags [P.], seq 19544:22084, ack 1, win 309, options [nop,nop,TS val 941594414 ecr 1439561122], length 2540
16:19:11.348334 IP ubuntu-s-1vcpu-1gb-tor1-01.ssh > 198.96.85.163.44901: Flags [P.], seq 22084:22304, ack 1, win 309, options [nop,nop,TS val 941594414 ecr 1439561122], length 220
16:19:11.348400 IP ubuntu-s-1vcpu-1gb-tor1-01.ssh > 198.96.85.163.44901: Flags [P.], seq 22304:22524, ack 1, win 309, options [nop,nop,TS val 941594414 ecr 1439561122], length 220
16:19:11.348466 IP ubuntu-s-1vcpu-1gb-tor1-01.ssh > 198.96.85.163.44901: Flags [P.], seq 22524:22744, ack 1, win 309, options [nop,nop,TS val 941594414 ecr 1439561122], length 220
16:19:11.348531 IP ubuntu-s-1vcpu-1gb-tor1-01.ssh > 198.96.85.163.44901: Flags [P.], seq 22744:22964, ack 1, win 309, options [nop,nop,TS val 941594414 ecr 1439561122], length 220
16:19:11.348597 IP ubuntu-s-1vcpu-1gb-tor1-01.ssh > 198.96.85.163.44901: Flags [P.], seq 22964:23184, ack 1, win 309, options [nop,nop,TS val 941594414 ecr 1439561122], length 220
16:19:11.348661 IP ubuntu-s-1vcpu-1gb-tor1-01.ssh > 198.96.85.163.44901: Flags [P.], seq 23184:23404, ack 1, win 309, options [nop,nop,TS val 941594415 ecr 1439561122], length 220
16:19:11.348727 IP ubuntu-s-1vcpu-1gb-tor1-01.ssh > 198.96.85.163.44901: Flags [P.], seq 23404:23624, ack 1, win 309, options [nop,nop,TS val 941594415 ecr 1439561122], length 220
16:19:11.348792 IP ubuntu-s-1vcpu-1gb-tor1-01.ssh > 198.96.85.163.44901: Flags [P.], seq 23624:23844, ack 1, win 309, options [nop,nop,TS val 941594415 ecr 1439561122], length 220
16:19:11.348863 IP ubuntu-s-1vcpu-1gb-tor1-01.ssh > 198.96.85.163.44901: Flags [P.], seq 23844:24064, ack 1, win 309, options [nop,nop,TS val 941594415 ecr 1439561122], length 220
16:19:11.348929 IP ubuntu-s-1vcpu-1gb-tor1-01.ssh > 198.96.85.163.44901: Flags [P.], seq 24064:24284, ack 1, win 309, options [nop,nop,TS val 941594415 ecr 1439561122], length 220
16:19:11.348993 IP ubuntu-s-1vcpu-1gb-tor1-01.ssh > 198.96.85.163.44901: Flags [P.], seq 24284:24504, ack 1, win 309, options [nop,nop,TS val 941594415 ecr 1439561122], length 220
16:19:11.349059 IP ubuntu-s-1vcpu-1gb-tor1-01.ssh > 198.96.85.163.44901: Flags [P.], seq 24504:24724, ack 1, win 309, options [nop,nop,TS val 941594415 ecr 1439561122], length 220
16:19:11.349123 IP ubuntu-s-1vcpu-1gb-tor1-01.ssh > 198.96.85.163.44901: Flags [P.], seq 24724:24944, ack 1, win 309, options [nop,nop,TS val 941594415 ecr 1439561122], length 220
16:19:11.349188 IP ubuntu-s-1vcpu-1gb-tor1-01.ssh > 198.96.85.163.44901: Flags [P.], seq 24944:25164, ack 1, win 309, options [nop,nop,TS val 941594415 ecr 1439561122], length 220
16:19:11.349257 IP ubuntu-s-1vcpu-1gb-tor1-01.ssh > 198.96.85.163.44901: Flags [P.], seq 25164:25384, ack 1, win 309, options [nop,nop,TS val 941594415 ecr 1439561122], length 220
16:19:11.349276 IP 198.96.85.163.44901 > ubuntu-s-1vcpu-1gb-tor1-01.ssh: Flags [.], ack 12524, win 2044, options [nop,nop,TS val 1439561122 ecr 941594411], length 0
16:19:11.349281 IP 198.96.85.163.44901 > ubuntu-s-1vcpu-1gb-tor1-01.ssh: Flags [.], ack 12560, win 2044, options [nop,nop,TS val 1439561122 ecr 941594411], length 0
16:19:11.349283 IP 198.96.85.163.44901 > ubuntu-s-1vcpu-1gb-tor1-01.ssh: Flags [.], ack 12780, win 2040, options [nop,nop,TS val 1439561122 ecr 941594411], length 0
16:19:11.349286 IP 198.96.85.163.44901 > ubuntu-s-1vcpu-1gb-tor1-01.ssh: Flags [.], ack 12816, win 2047, options [nop,nop,TS val 1439561123 ecr 941594411], length 0
16:19:11.349301 IP 198.96.85.163.44901 > ubuntu-s-1vcpu-1gb-tor1-01.ssh: Flags [.], ack 13036, win 2044, options [nop,nop,TS val 1439561123 ecr 941594411], length 0
16:19:11.349314 IP 198.96.85.163.44901 > ubuntu-s-1vcpu-1gb-tor1-01.ssh: Flags [.], ack 13072, win 2047, options [nop,nop,TS val 1439561123 ecr 941594411], length 0
16:19:11.349460 IP ubuntu-s-1vcpu-1gb-tor1-01.ssh > 198.96.85.163.44901: Flags [P.], seq 25384:26596, ack 1, win 309, options [nop,nop,TS val 941594415 ecr 1439561123], length 1212
16:19:11.349533 IP ubuntu-s-1vcpu-1gb-tor1-01.ssh > 198.96.85.163.44901: Flags [P.], seq 26596:26816, ack 1, win 309, options [nop,nop,TS val 941594415 ecr 1439561123], length 220
16:19:11.349598 IP ubuntu-s-1vcpu-1gb-tor1-01.ssh > 198.96.85.163.44901: Flags [P.], seq 26816:27036, ack 1, win 309, options [nop,nop,TS val 941594415 ecr 1439561123], length 220
16:19:11.349664 IP ubuntu-s-1vcpu-1gb-tor1-01.ssh > 198.96.85.163.44901: Flags [P.], seq 27036:27256, ack 1, win 309, options [nop,nop,TS val 941594416 ecr 1439561123], length 220
16:19:11.349728 IP ubuntu-s-1vcpu-1gb-tor1-01.ssh > 198.96.85.163.44901: Flags [P.], seq 27256:27476, ack 1, win 309, options [nop,nop,TS val 941594416 ecr 1439561123], length 220
16:19:11.349795 IP ubuntu-s-1vcpu-1gb-tor1-01.ssh > 198.96.85.163.44901: Flags [P.], seq 27476:27696, ack 1, win 309, options [nop,nop,TS val 941594416 ecr 1439561123], length 220
16:19:11.349865 IP 198.96.85.163.44901 > ubuntu-s-1vcpu-1gb-tor1-01.ssh: Flags [.], ack 13548, win 2044, options [nop,nop,TS val 1439561124 ecr 941594411], length 0
16:19:11.349874 IP 198.96.85.163.44901 > ubuntu-s-1vcpu-1gb-tor1-01.ssh: Flags [.], ack 13584, win 2044, options [nop,nop,TS val 1439561124 ecr 941594411], length 0
16:19:11.349878 IP 198.96.85.163.44901 > ubuntu-s-1vcpu-1gb-tor1-01.ssh: Flags [.], ack 13804, win 2044, options [nop,nop,TS val 1439561124 ecr 941594412], length 0
16:19:11.349882 IP 198.96.85.163.44901 > ubuntu-s-1vcpu-1gb-tor1-01.ssh: Flags [.], ack 13840, win 2044, options [nop,nop,TS val 1439561124 ecr 941594412], length 0
16:19:11.349886 IP 198.96.85.163.44901 > ubuntu-s-1vcpu-1gb-tor1-01.ssh: Flags [.], ack 14060, win 2040, options [nop,nop,TS val 1439561124 ecr 941594412], length 0
16:19:11.349888 IP 198.96.85.163.44901 > ubuntu-s-1vcpu-1gb-tor1-01.ssh: Flags [.], ack 14096, win 2040, options [nop,nop,TS val 1439561124 ecr 941594412], length 0
16:19:11.349921 IP ubuntu-s-1vcpu-1gb-tor1-01.ssh > 198.96.85.163.44901: Flags [P.], seq 27696:27916, ack 1, win 309, options [nop,nop,TS val 941594416 ecr 1439561124], length 220
16:19:11.350026 IP 198.96.85.163.44901 > ubuntu-s-1vcpu-1gb-tor1-01.ssh: Flags [.], ack 14316, win 2036, options [nop,nop,TS val 1439561124 ecr 941594412], length 0
16:19:11.350034 IP 198.96.85.163.44901 > ubuntu-s-1vcpu-1gb-tor1-01.ssh: Flags [.], ack 14352, win 2036, options [nop,nop,TS val 1439561124 ecr 941594412], length 0
16:19:11.350038 IP 198.96.85.163.44901 > ubuntu-s-1vcpu-1gb-tor1-01.ssh: Flags [.], ack 14572, win 2032, options [nop,nop,TS val 1439561124 ecr 941594412], length 0
16:19:11.350041 IP 198.96.85.163.44901 > ubuntu-s-1vcpu-1gb-tor1-01.ssh: Flags [.], ack 15336, win 2020, options [nop,nop,TS val 1439561124 ecr 941594412], length 0
16:19:11.350084 IP 198.96.85.163.44901 > ubuntu-s-1vcpu-1gb-tor1-01.ssh: Flags [.], ack 16136, win 2008, options [nop,nop,TS val 1439561124 ecr 941594412], length 0
16:19:11.350090 IP 198.96.85.163.44901 > ubuntu-s-1vcpu-1gb-tor1-01.ssh: Flags [.], ack 16356, win 2004, options [nop,nop,TS val 1439561124 ecr 941594412], length 0
16:19:11.350241 IP ubuntu-s-1vcpu-1gb-tor1-01.ssh > 198.96.85.163.44901: Flags [P.], seq 27916:30128, ack 1, win 309, options [nop,nop,TS val 941594416 ecr 1439561124], length 2212
16:19:11.350316 IP ubuntu-s-1vcpu-1gb-tor1-01.ssh > 198.96.85.163.44901: Flags [P.], seq 30128:30348, ack 1, win 309, options [nop,nop,TS val 941594416 ecr 1439561124], length 220
16:19:11.350382 IP ubuntu-s-1vcpu-1gb-tor1-01.ssh > 198.96.85.163.44901: Flags [P.], seq 30348:30568, ack 1, win 309, options [nop,nop,TS val 941594416 ecr 1439561124], length 220
16:19:11.350459 IP ubuntu-s-1vcpu-1gb-tor1-01.ssh > 198.96.85.163.44901: Flags [P.], seq 30568:30788, ack 1, win 309, options [nop,nop,TS val 941594416 ecr 1439561124], length 220
16:19:11.350524 IP ubuntu-s-1vcpu-1gb-tor1-01.ssh > 198.96.85.163.44901: Flags [P.], seq 30788:31008, ack 1, win 309, options [nop,nop,TS val 941594416 ecr 1439561124], length 220
16:19:11.350590 IP ubuntu-s-1vcpu-1gb-tor1-01.ssh > 198.96.85.163.44901: Flags [P.], seq 31008:31228, ack 1, win 309, options [nop,nop,TS val 941594416 ecr 1439561124], length 220
16:19:11.350657 IP ubuntu-s-1vcpu-1gb-tor1-01.ssh > 198.96.85.163.44901: Flags [P.], seq 31228:31448, ack 1, win 309, options [nop,nop,TS val 941594417 ecr 1439561124], length 220
16:19:11.350740 IP ubuntu-s-1vcpu-1gb-tor1-01.ssh > 198.96.85.163.44901: Flags [P.], seq 31448:31668, ack 1, win 309, options [nop,nop,TS val 941594417 ecr 1439561124], length 220
16:19:11.350811 IP ubuntu-s-1vcpu-1gb-tor1-01.ssh > 198.96.85.163.44901: Flags [P.], seq 31668:31888, ack 1, win 309, options [nop,nop,TS val 941594417 ecr 1439561124], length 220
16:19:11.350876 IP ubuntu-s-1vcpu-1gb-tor1-01.ssh > 198.96.85.163.44901: Flags [P.], seq 31888:32108, ack 1, win 309, options [nop,nop,TS val 941594417 ecr 1439561124], length 220
16:19:11.350944 IP ubuntu-s-1vcpu-1gb-tor1-01.ssh > 198.96.85.163.44901: Flags [P.], seq 32108:32328, ack 1, win 309, options [nop,nop,TS val 941594417 ecr 1439561124], length 220
16:19:11.351009 IP ubuntu-s-1vcpu-1gb-tor1-01.ssh > 198.96.85.163.44901: Flags [P.], seq 32328:32548, ack 1, win 309, options [nop,nop,TS val 941594417 ecr 1439561124], length 220
16:19:11.351062 IP 198.96.85.163.44901 > ubuntu-s-1vcpu-1gb-tor1-01.ssh: Flags [.], ack 17836, win 2044, options [nop,nop,TS val 1439561124 ecr 941594413], length 0
16:19:11.351070 IP 198.96.85.163.44901 > ubuntu-s-1vcpu-1gb-tor1-01.ssh: Flags [.], ack 18224, win 2041, options [nop,nop,TS val 1439561124 ecr 941594413], length 0
16:19:11.351141 IP ubuntu-s-1vcpu-1gb-tor1-01.ssh > 198.96.85.163.44901: Flags [P.], seq 32548:33096, ack 1, win 309, options [nop,nop,TS val 941594417 ecr 1439561124], length 548
16:19:11.351215 IP ubuntu-s-1vcpu-1gb-tor1-01.ssh > 198.96.85.163.44901: Flags [P.], seq 33096:33316, ack 1, win 309, options [nop,nop,TS val 941594417 ecr 1439561124], length 220
16:19:11.351282 IP ubuntu-s-1vcpu-1gb-tor1-01.ssh > 198.96.85.163.44901: Flags [P.], seq 33316:33536, ack 1, win 309, options [nop,nop,TS val 941594417 ecr 1439561124], length 220
16:19:11.351366 IP ubuntu-s-1vcpu-1gb-tor1-01.ssh > 198.96.85.163.44901: Flags [P.], seq 33536:33756, ack 1, win 309, options [nop,nop,TS val 941594417 ecr 1439561124], length 220
16:19:11.351436 IP ubuntu-s-1vcpu-1gb-tor1-01.ssh > 198.96.85.163.44901: Flags [P.], seq 33756:33976, ack 1, win 309, options [nop,nop,TS val 941594417 ecr 1439561124], length 220
16:19:11.351500 IP ubuntu-s-1vcpu-1gb-tor1-01.ssh > 198.96.85.163.44901: Flags [P.], seq 33976:34196, ack 1, win 309, options [nop,nop,TS val 941594417 ecr 1439561124], length 220
16:19:11.351576 IP ubuntu-s-1vcpu-1gb-tor1-01.ssh > 198.96.85.163.44901: Flags [P.], seq 34196:34416, ack 1, win 309, options [nop,nop,TS val 941594417 ecr 1439561124], length 220
16:19:11.351641 IP ubuntu-s-1vcpu-1gb-tor1-01.ssh > 198.96.85.163.44901: Flags [P.], seq 34416:34636, ack 1, win 309, options [nop,nop,TS val 941594418 ecr 1439561124], length 220
16:19:11.351707 IP ubuntu-s-1vcpu-1gb-tor1-01.ssh > 198.96.85.163.44901: Flags [P.], seq 34636:34856, ack 1, win 309, options [nop,nop,TS val 941594418 ecr 1439561124], length 220
16:19:11.351775 IP ubuntu-s-1vcpu-1gb-tor1-01.ssh > 198.96.85.163.44901: Flags [P.], seq 34856:35076, ack 1, win 309, options [nop,nop,TS val 941594418 ecr 1439561124], length 220
16:19:11.351844 IP ubuntu-s-1vcpu-1gb-tor1-01.ssh > 198.96.85.163.44901: Flags [P.], seq 35076:35296, ack 1, win 309, options [nop,nop,TS val 941594418 ecr 1439561124], length 220
16:19:11.351909 IP ubuntu-s-1vcpu-1gb-tor1-01.ssh > 198.96.85.163.44901: Flags [P.], seq 35296:35516, ack 1, win 309, options [nop,nop,TS val 941594418 ecr 1439561124], length 220
16:19:11.351976 IP ubuntu-s-1vcpu-1gb-tor1-01.ssh > 198.96.85.163.44901: Flags [P.], seq 35516:35736, ack 1, win 309, options [nop,nop,TS val 941594418 ecr 1439561124], length 220
16:19:11.352041 IP ubuntu-s-1vcpu-1gb-tor1-01.ssh > 198.96.85.163.44901: Flags [P.], seq 35736:35956, ack 1, win 309, options [nop,nop,TS val 941594418 ecr 1439561124], length 220
16:19:11.352120 IP ubuntu-s-1vcpu-1gb-tor1-01.ssh > 198.96.85.163.44901: Flags [P.], seq 35956:36176, ack 1, win 309, options [nop,nop,TS val 941594418 ecr 1439561124], length 220
16:19:11.352185 IP ubuntu-s-1vcpu-1gb-tor1-01.ssh > 198.96.85.163.44901: Flags [P.], seq 36176:36396, ack 1, win 309, options [nop,nop,TS val 941594418 ecr 1439561124], length 220
16:19:11.352250 IP ubuntu-s-1vcpu-1gb-tor1-01.ssh > 198.96.85.163.44901: Flags [P.], seq 36396:36616, ack 1, win 309, options [nop,nop,TS val 941594418 ecr 1439561124], length 220
16:19:11.352314 IP ubuntu-s-1vcpu-1gb-tor1-01.ssh > 198.96.85.163.44901: Flags [P.], seq 36616:36836, ack 1, win 309, options [nop,nop,TS val 941594418 ecr 1439561124], length 220
16:19:11.352379 IP ubuntu-s-1vcpu-1gb-tor1-01.ssh > 198.96.85.163.44901: Flags [P.], seq 36836:37056, ack 1, win 309, options [nop,nop,TS val 941594418 ecr 1439561124], length 220
16:19:11.352443 IP ubuntu-s-1vcpu-1gb-tor1-01.ssh > 198.96.85.163.44901: Flags [P.], seq 37056:37276, ack 1, win 309, options [nop,nop,TS val 941594418 ecr 1439561124], length 220
16:19:11.352506 IP ubuntu-s-1vcpu-1gb-tor1-01.ssh > 198.96.85.163.44901: Flags [P.], seq 37276:37496, ack 1, win 309, options [nop,nop,TS val 941594418 ecr 1439561124], length 220
16:19:11.352571 IP ubuntu-s-1vcpu-1gb-tor1-01.ssh > 198.96.85.163.44901: Flags [P.], seq 37496:37716, ack 1, win 309, options [nop,nop,TS val 941594418 ecr 1439561124], length 220
16:19:11.352646 IP ubuntu-s-1vcpu-1gb-tor1-01.ssh > 198.96.85.163.44901: Flags [P.], seq 37716:37936, ack 1, win 309, options [nop,nop,TS val 941594419 ecr 1439561124], length 220
16:19:11.352730 IP ubuntu-s-1vcpu-1gb-tor1-01.ssh > 198.96.85.163.44901: Flags [P.], seq 37936:38156, ack 1, win 309, options [nop,nop,TS val 941594419 ecr 1439561124], length 220
16:19:11.352833 IP ubuntu-s-1vcpu-1gb-tor1-01.ssh > 198.96.85.163.44901: Flags [P.], seq 38156:38376, ack 1, win 309, options [nop,nop,TS val 941594419 ecr 1439561124], length 220
16:19:11.352895 IP ubuntu-s-1vcpu-1gb-tor1-01.ssh > 198.96.85.163.44901: Flags [P.], seq 38376:38596, ack 1, win 309, options [nop,nop,TS val 941594419 ecr 1439561124], length 220
16:19:11.352948 IP ubuntu-s-1vcpu-1gb-tor1-01.ssh > 198.96.85.163.44901: Flags [P.], seq 38596:38816, ack 1, win 309, options [nop,nop,TS val 941594419 ecr 1439561124], length 220
16:19:11.353000 IP ubuntu-s-1vcpu-1gb-tor1-01.ssh > 198.96.85.163.44901: Flags [P.], seq 38816:39036, ack 1, win 309, options [nop,nop,TS val 941594419 ecr 1439561124], length 220
16:19:11.353048 IP 198.96.85.163.44901 > ubuntu-s-1vcpu-1gb-tor1-01.ssh: Flags [.], ack 18444, win 2044, options [nop,nop,TS val 1439561127 ecr 941594413], length 0
16:19:11.353056 IP 198.96.85.163.44901 > ubuntu-s-1vcpu-1gb-tor1-01.ssh: Flags [.], ack 18664, win 2041, options [nop,nop,TS val 1439561127 ecr 941594413], length 0
16:19:11.353122 IP ubuntu-s-1vcpu-1gb-tor1-01.ssh > 198.96.85.163.44901: Flags [P.], seq 39036:39584, ack 1, win 309, options [nop,nop,TS val 941594419 ecr 1439561127], length 548
16:19:11.353195 IP ubuntu-s-1vcpu-1gb-tor1-01.ssh > 198.96.85.163.44901: Flags [P.], seq 39584:39804, ack 1, win 309, options [nop,nop,TS val 941594419 ecr 1439561127], length 220
16:19:11.353250 IP ubuntu-s-1vcpu-1gb-tor1-01.ssh > 198.96.85.163.44901: Flags [P.], seq 39804:40024, ack 1, win 309, options [nop,nop,TS val 941594419 ecr 1439561127], length 220
16:19:11.353302 IP ubuntu-s-1vcpu-1gb-tor1-01.ssh > 198.96.85.163.44901: Flags [P.], seq 40024:40244, ack 1, win 309, options [nop,nop,TS val 941594419 ecr 1439561127], length 220
16:19:11.353354 IP ubuntu-s-1vcpu-1gb-tor1-01.ssh > 198.96.85.163.44901: Flags [P.], seq 40244:40464, ack 1, win 309, options [nop,nop,TS val 941594419 ecr 1439561127], length 220
16:19:11.353405 IP ubuntu-s-1vcpu-1gb-tor1-01.ssh > 198.96.85.163.44901: Flags [P.], seq 40464:40684, ack 1, win 309, options [nop,nop,TS val 941594419 ecr 1439561127], length 220
16:19:11.353456 IP ubuntu-s-1vcpu-1gb-tor1-01.ssh > 198.96.85.163.44901: Flags [P.], seq 40684:40904, ack 1, win 309, options [nop,nop,TS val 941594419 ecr 1439561127], length 220
16:19:11.353507 IP ubuntu-s-1vcpu-1gb-tor1-01.ssh > 198.96.85.163.44901: Flags [P.], seq 40904:41124, ack 1, win 309, options [nop,nop,TS val 941594419 ecr 1439561127], length 220
16:19:11.353558 IP ubuntu-s-1vcpu-1gb-tor1-01.ssh > 198.96.85.163.44901: Flags [P.], seq 41124:41344, ack 1, win 309, options [nop,nop,TS val 941594419 ecr 1439561127], length 220
16:19:11.353609 IP ubuntu-s-1vcpu-1gb-tor1-01.ssh > 198.96.85.163.44901: Flags [P.], seq 41344:41564, ack 1, win 309, options [nop,nop,TS val 941594419 ecr 1439561127], length 220
16:19:11.353664 IP ubuntu-s-1vcpu-1gb-tor1-01.ssh > 198.96.85.163.44901: Flags [P.], seq 41564:41784, ack 1, win 309, options [nop,nop,TS val 941594420 ecr 1439561127], length 220
16:19:11.353728 IP ubuntu-s-1vcpu-1gb-tor1-01.ssh > 198.96.85.163.44901: Flags [P.], seq 41784:42004, ack 1, win 309, options [nop,nop,TS val 941594420 ecr 1439561127], length 220
16:19:11.353781 IP 198.96.85.163.44901 > ubuntu-s-1vcpu-1gb-tor1-01.ssh: Flags [.], ack 18884, win 2044, options [nop,nop,TS val 1439561127 ecr 941594413], length 0
16:19:11.353789 IP 198.96.85.163.44901 > ubuntu-s-1vcpu-1gb-tor1-01.ssh: Flags [.], ack 19104, win 2041, options [nop,nop,TS val 1439561127 ecr 941594413], length 0
16:19:11.353793 IP 198.96.85.163.44901 > ubuntu-s-1vcpu-1gb-tor1-01.ssh: Flags [.], ack 19324, win 2037, options [nop,nop,TS val 1439561127 ecr 941594413], length 0
16:19:11.353812 IP 198.96.85.163.44901 > ubuntu-s-1vcpu-1gb-tor1-01.ssh: Flags [.], ack 19544, win 2034, options [nop,nop,TS val 1439561127 ecr 941594414], length 0
16:19:11.353818 IP 198.96.85.163.44901 > ubuntu-s-1vcpu-1gb-tor1-01.ssh: Flags [.], ack 22084, win 1994, options [nop,nop,TS val 1439561127 ecr 941594414], length 0
16:19:11.353822 IP 198.96.85.163.44901 > ubuntu-s-1vcpu-1gb-tor1-01.ssh: Flags [.], ack 22304, win 1991, options [nop,nop,TS val 1439561127 ecr 941594414], length 0
16:19:11.353835 IP 198.96.85.163.44901 > ubuntu-s-1vcpu-1gb-tor1-01.ssh: Flags [.], ack 22524, win 1987, options [nop,nop,TS val 1439561127 ecr 941594414], length 0
16:19:11.353905 IP 198.96.85.163.44901 > ubuntu-s-1vcpu-1gb-tor1-01.ssh: Flags [.], ack 22744, win 1984, options [nop,nop,TS val 1439561127 ecr 941594414], length 0
16:19:11.353909 IP 198.96.85.163.44901 > ubuntu-s-1vcpu-1gb-tor1-01.ssh: Flags [.], ack 22964, win 1980, options [nop,nop,TS val 1439561127 ecr 941594414], length 0
16:19:11.353911 IP 198.96.85.163.44901 > ubuntu-s-1vcpu-1gb-tor1-01.ssh: Flags [.], ack 23184, win 1977, options [nop,nop,TS val 1439561127 ecr 941594414], length 0
16:19:11.353936 IP 198.96.85.163.44901 > ubuntu-s-1vcpu-1gb-tor1-01.ssh: Flags [.], ack 23404, win 1973, options [nop,nop,TS val 1439561127 ecr 941594415], length 0
16:19:11.353940 IP 198.96.85.163.44901 > ubuntu-s-1vcpu-1gb-tor1-01.ssh: Flags [.], ack 23624, win 1970, options [nop,nop,TS val 1439561127 ecr 941594415], length 0
16:19:11.353942 IP 198.96.85.163.44901 > ubuntu-s-1vcpu-1gb-tor1-01.ssh: Flags [.], ack 23844, win 1967, options [nop,nop,TS val 1439561127 ecr 941594415], length 0
16:19:11.354057 IP 198.96.85.163.44901 > ubuntu-s-1vcpu-1gb-tor1-01.ssh: Flags [.], ack 24064, win 1963, options [nop,nop,TS val 1439561127 ecr 941594415], length 0
16:19:11.354066 IP 198.96.85.163.44901 > ubuntu-s-1vcpu-1gb-tor1-01.ssh: Flags [.], ack 24284, win 1960, options [nop,nop,TS val 1439561127 ecr 941594415], length 0
16:19:11.354074 IP 198.96.85.163.44901 > ubuntu-s-1vcpu-1gb-tor1-01.ssh: Flags [.], ack 24504, win 1956, options [nop,nop,TS val 1439561127 ecr 941594415], length 0
16:19:11.354078 IP 198.96.85.163.44901 > ubuntu-s-1vcpu-1gb-tor1-01.ssh: Flags [.], ack 24724, win 1953, options [nop,nop,TS val 1439561127 ecr 941594415], length 0
16:19:11.354095 IP 198.96.85.163.44901 > ubuntu-s-1vcpu-1gb-tor1-01.ssh: Flags [.], ack 24944, win 1949, options [nop,nop,TS val 1439561127 ecr 941594415], length 0
16:19:11.354105 IP ubuntu-s-1vcpu-1gb-tor1-01.ssh > 198.96.85.163.44901: Flags [P.], seq 42004:44384, ack 1, win 309, options [nop,nop,TS val 941594420 ecr 1439561127], length 2380
16:19:11.354120 IP 198.96.85.163.44901 > ubuntu-s-1vcpu-1gb-tor1-01.ssh: Flags [.], ack 24944, win 2048, options [nop,nop,TS val 1439561127 ecr 941594415], length 0
16:19:11.354224 IP 198.96.85.163.44901 > ubuntu-s-1vcpu-1gb-tor1-01.ssh: Flags [.], ack 27256, win 2011, options [nop,nop,TS val 1439561127 ecr 941594416], length 0
16:19:11.354229 IP 198.96.85.163.44901 > ubuntu-s-1vcpu-1gb-tor1-01.ssh: Flags [.], ack 27476, win 2008, options [nop,nop,TS val 1439561127 ecr 941594416], length 0
16:19:11.354231 IP 198.96.85.163.44901 > ubuntu-s-1vcpu-1gb-tor1-01.ssh: Flags [.], ack 27696, win 2005, options [nop,nop,TS val 1439561127 ecr 941594416], length 0
16:19:11.354256 IP 198.96.85.163.44901 > ubuntu-s-1vcpu-1gb-tor1-01.ssh: Flags [.], ack 27916, win 2001, options [nop,nop,TS val 1439561127 ecr 941594416], length 0
16:19:11.354259 IP 198.96.85.163.44901 > ubuntu-s-1vcpu-1gb-tor1-01.ssh: Flags [.], ack 30128, win 1967, options [nop,nop,TS val 1439561127 ecr 941594416], length 0
16:19:11.354284 IP 198.96.85.163.44901 > ubuntu-s-1vcpu-1gb-tor1-01.ssh: Flags [.], ack 30568, win 1960, options [nop,nop,TS val 1439561127 ecr 941594416], length 0
16:19:11.354342 IP 198.96.85.163.44901 > ubuntu-s-1vcpu-1gb-tor1-01.ssh: Flags [.], ack 31008, win 1953, options [nop,nop,TS val 1439561127 ecr 941594416], length 0
16:19:11.354346 IP 198.96.85.163.44901 > ubuntu-s-1vcpu-1gb-tor1-01.ssh: Flags [.], ack 31228, win 1949, options [nop,nop,TS val 1439561127 ecr 941594416], length 0
16:19:11.354348 IP 198.96.85.163.44901 > ubuntu-s-1vcpu-1gb-tor1-01.ssh: Flags [.], ack 31448, win 1946, options [nop,nop,TS val 1439561127 ecr 941594417], length 0
16:19:11.354455 IP ubuntu-s-1vcpu-1gb-tor1-01.ssh > 198.96.85.163.44901: Flags [P.], seq 44384:47092, ack 1, win 309, options [nop,nop,TS val 941594420 ecr 1439561127], length 2708
16:19:11.354550 IP ubuntu-s-1vcpu-1gb-tor1-01.ssh > 198.96.85.163.44901: Flags [P.], seq 47092:47312, ack 1, win 309, options [nop,nop,TS val 941594420 ecr 1439561127], length 220
16:19:11.354608 IP ubuntu-s-1vcpu-1gb-tor1-01.ssh > 198.96.85.163.44901: Flags [P.], seq 47312:47532, ack 1, win 309, options [nop,nop,TS val 941594420 ecr 1439561127], length 220
16:19:11.354662 IP ubuntu-s-1vcpu-1gb-tor1-01.ssh > 198.96.85.163.44901: Flags [P.], seq 47532:47752, ack 1, win 309, options [nop,nop,TS val 941594421 ecr 1439561127], length 220
16:19:11.354746 IP ubuntu-s-1vcpu-1gb-tor1-01.ssh > 198.96.85.163.44901: Flags [P.], seq 47752:47972, ack 1, win 309, options [nop,nop,TS val 941594421 ecr 1439561127], length 220
